{
    "id": "urn:ngsi-ld:0001",
    "type": "HydrogenGenerator",
    "title": "HG4U Pro",
    "operatingTemperatureMin": 5,
    "operatingTemperatureMax": 35,
    "storageTemperatureMin": 1,
    "storageTemperatureMax": 40,
    "operatingHumidity": 80,
    "noise": 80,
    "ingressProtection": "IP20",
    "pollutionDegreeRating": 2,
    "waterConsumption": 0.001,
    "altitude": "<2000 m",
    "electrolyticCell": "PEM",
    "dryingSystem": "PSA",
    "h2Purity": ">99.99999% referred to O2, Dew-point",
    "outletPressure": 12,
    "h2FlowRate": 1000,
    "netWeight": 25,
    "RS485": "Standard",
    "RS232": "Standard",
    "USB": "Standard",
    "LAN": "Optional",
    "parallelModeCapability": "Standard",
    "fillCanisterFunction": "Standard",
    "quality": "Deionized, ASTM II, <0.1uS",
    "supplyPressureMin": 0,
    "supplyPressureMax": 0.5,
    "supplyFlowRateMin": 0.2,
    "supplyFlowRateMax": 1.5,
    "internalWaterTankCapacity": 1.1,
    "externalWaterTankCapacity": 5,
    "connectionType": "IEC320-C14",
    "supplyVoltage": "100-240Vac (?10%) 50/60Hz",
    "nominalPower": 450,
    "fuseRating": "6,3A (250VAC ? T ? L / 35A)",
    "hydrogenOutlet": "1/8? Compression Fitting",
    "water": "Quick Release Push in Fitting"
}